{
  "id": "qzs-6",
  "norad_id": 62876,
  "name": {
    "ja": "みちびき6号機",
    "en": "QZS-6"
  },
  "class": "navigation",
  "operator": {
    "value": "内閣府",
    "source": "https://www8.cao.go.jp/space/qzs/qzs.html",
    "as_of": "2026-09-30",
    "note": "運用は PFI 事業として準天頂衛星システムサービス株式会社が行う"
  },
  "operator_type": {
    "value": "civil",
    "source": "https://www8.cao.go.jp/space/qzs/qzs.html",
    "as_of": "2026-09-30"
  },
  "launch_date": {
    "value": "2025-02-02",
    "source": "https://qzss.go.jp/technical/satellites/index.html",
    "as_of": "2026-09-30"
  },
  "mission": {
    "value": "GPS と一体で使える測位の信号を送り、位置を安定して測れるようにする",
    "source": "https://qzss.go.jp/overview/services/sv04_pnt.html",
    "as_of": "2026-09-30"
  },
  "status": {
    "value": "operating",
    "source": "https://sys.qzss.go.jp/dod/constellation.html",
    "as_of": "2026-09-30"
  },
  "stats": {
    "altitude_km": {
      "value": 36000,
      "unit": "km",
      "source": "https://qzss.go.jp/info/information/qzs6_250218.html",
      "as_of": "2026-09-30",
      "note": "おおよその値。静止位置の高さ"
    },
    "mass_kg": {
      "value": 1700,
      "unit": "kg",
      "source": "https://qzss.go.jp/7satellite-constellation/qzs-6/outline.html",
      "as_of": "2026-09-30",
      "note": "おおよその値。ドライ質量（打ち上げ時は約4,800 kg）"
    },
    "length_m": {
      "value": 19,
      "unit": "m",
      "source": "https://qzss.go.jp/7satellite-constellation/qzs-6/outline.html",
      "as_of": "2026-09-30",
      "note": "おおよその値。翼の端から端まで"
    }
  },
  "image": {
    "file": "assets/craft/qzs-6.jpg",
    "source": "https://qzss.go.jp/7satellite-constellation/qzs-6/outline.html",
    "credit": "提供：内閣府宇宙開発戦略推進事務局",
    "caption": "みちびき6号機のイメージ",
    "terms": "https://qzss.go.jp/policy/rule.html"
  },
  "official_links": [
    {
      "label": "みちびき6号機",
      "url": "https://qzss.go.jp/7satellite-constellation/qzs-6/outline.html"
    },
    {
      "label": "みちびき 衛星運用状況",
      "url": "https://sys.qzss.go.jp/dod/constellation.html"
    }
  ],
  "updated_at": "2026-09-30"
}
