{
  "id": "hinode",
  "norad_id": 29479,
  "name": {
    "ja": "ひので",
    "en": "HINODE (SOLAR-B)"
  },
  "class": "science",
  "operator": {
    "value": "JAXA 宇宙科学研究所",
    "source": "https://www.isas.jaxa.jp/missions/spacecraft/current/hinode.html",
    "as_of": "2026-09-30",
    "note": "国立天文台と協力して開発。科学運用は NASA・STFC・ESA・NSC などとの国際協力"
  },
  "operator_type": {
    "value": "civil",
    "source": "https://www.jaxa.jp/about/jaxa/",
    "as_of": "2026-09-30"
  },
  "launch_date": {
    "value": "2006-09-23",
    "source": "https://www.isas.jaxa.jp/missions/spacecraft/current/hinode.html",
    "as_of": "2026-09-30"
  },
  "mission": {
    "value": "太陽の磁場・コロナ・フレアを観測し、太陽で起こる活動や加熱のしくみを調べる",
    "source": "https://www.isas.jaxa.jp/missions/spacecraft/current/hinode.html",
    "as_of": "2026-09-30"
  },
  "status": {
    "value": "operating",
    "source": "https://www.isas.jaxa.jp/missions/spacecraft/current/hinode.html",
    "as_of": "2026-09-30"
  },
  "stats": {
    "altitude_km": {
      "value": 680,
      "unit": "km",
      "source": "https://www.isas.jaxa.jp/missions/spacecraft/current/hinode.html",
      "as_of": "2026-09-30",
      "note": "おおよその値（公称）"
    },
    "period_min": {
      "value": 98,
      "unit": "min",
      "source": "https://www.isas.jaxa.jp/missions/spacecraft/current/hinode.html",
      "as_of": "2026-09-30"
    },
    "mass_kg": {
      "value": 900,
      "unit": "kg",
      "source": "https://www.isas.jaxa.jp/missions/spacecraft/current/hinode.html",
      "as_of": "2026-09-30"
    },
    "length_m": {
      "value": 10,
      "unit": "m",
      "source": "https://www.isas.jaxa.jp/missions/spacecraft/current/hinode.html",
      "as_of": "2026-09-30",
      "note": "太陽電池パドルの端から端まで"
    }
  },
  "official_links": [
    {
      "label": "JAXA 宇宙科学研究所",
      "url": "https://www.isas.jaxa.jp/missions/spacecraft/current/hinode.html"
    },
    {
      "label": "国立天文台 ひので科学プロジェクト",
      "url": "https://hinode.nao.ac.jp/intro/outline/"
    }
  ],
  "updated_at": "2026-09-30"
}
