{
  "id": "iss",
  "norad_id": 25544,
  "name": {
    "ja": "国際宇宙ステーション",
    "en": "International Space Station"
  },
  "class": "crewed_station",
  "operator": {
    "value": ["NASA", "Roscosmos", "JAXA", "ESA", "CSA"],
    "source": "https://oig.nasa.gov/wp-content/uploads/2024/02/IG-23-004.pdf",
    "as_of": "2026-09-30"
  },
  "operator_type": {
    "value": "civil",
    "source": "https://www.esa.int/Science_Exploration/Human_and_Robotic_Exploration/International_Space_Station/International_Space_Station_legal_framework",
    "as_of": "2026-09-30",
    "note": "ISS の政府間協定で「平和目的の民生用宇宙基地」とされている"
  },
  "launch_date": {
    "value": "1998-11-20",
    "source": "https://www.nasa.gov/missions/station/the-international-space-station-20-years-of-communications-excellence/",
    "as_of": "2026-09-30",
    "note": "最初のモジュール「ザーリャ」の打ち上げ"
  },
  "mission": {
    "value": "宇宙で科学研究と技術の実証をする拠点",
    "source": "https://www.nasa.gov/news-release/nasa-names-new-station-manager-space-operations-deputy/",
    "as_of": "2026-09-30"
  },
  "status": {
    "value": "operating",
    "source": "https://www.nasa.gov/international-space-station/space-station-overview/",
    "as_of": "2026-09-30",
    "note": "参加機関は2030年までの運用を約束している（NASA の FAQ）"
  },
  "stats": {
    "altitude_km": {
      "value": 400,
      "unit": "km",
      "source": "https://www.nasa.gov/learning-resources/for-kids-and-students/what-is-the-international-space-station-grades-5-8/",
      "as_of": "2026-09-30",
      "note": "おおよその値。NASA は平均の高さを約250マイル（約402 km）としている"
    },
    "speed_km_s": {
      "value": 7.8,
      "unit": "km/s",
      "source": "https://www.nasa.gov/missions/station/spot-the-station-frequently-asked-questions/",
      "as_of": "2026-09-30",
      "note": "おおよその値。時速約28,000 km（NASA）を秒速に直した"
    },
    "period_min": {
      "value": 90,
      "unit": "min",
      "source": "https://eol.jsc.nasa.gov/Tools/orbitTutorial.htm",
      "as_of": "2026-09-30",
      "note": "おおよその値。高さによって90〜93分"
    },
    "mass_kg": {
      "value": 419725,
      "unit": "kg",
      "source": "https://www.nasa.gov/international-space-station/space-station-facts-and-figures/",
      "as_of": "2026-09-30"
    },
    "length_m": {
      "value": 109,
      "unit": "m",
      "source": "https://www.nasa.gov/reference/international-space-station/",
      "as_of": "2026-09-30",
      "note": "太陽電池パネルの方向に測った長さ"
    }
  },
  "catchphrase": "90分で地球を1周する、空飛ぶ研究所",
  "official_links": [
    { "label": "NASA 国際宇宙ステーション", "url": "https://www.nasa.gov/international-space-station/" },
    { "label": "JAXA「きぼう」日本実験棟", "url": "https://humans-in-space.jaxa.jp/kibo/" },
    { "label": "ESA 国際宇宙ステーション", "url": "https://www.esa.int/Science_Exploration/Human_and_Robotic_Exploration/International_Space_Station" }
  ],
  "updated_at": "2026-09-30"
}
